Welcome to Address Book Database Management System.

mysql> show databases;
+--------------------+
| Database           |
+--------------------+
| information_schema |
| mysql              |
| payroll_service    |
| performance_schema |
| sakila             |
| sys                |
| world              |
+--------------------+
7 rows in set (0.04 sec)

mysql> create database address_book;
Query OK, 1 row affected (0.09 sec)

mysql> show databases;
+--------------------+
| Database           |
+--------------------+
| address_book       |
| information_schema |
| mysql              |
| payroll_service    |
| performance_schema |
| sakila             |
| sys                |
| world              |
+--------------------+
8 rows in set (0.10 sec)

mysql> use address_book;
Database changed
mysql> select database();
+--------------+
| database()   |
+--------------+
| address_book |
+--------------+
1 row in set (0.00 sec)

mysql> create table addressbook
    -> (
    -> id       int unsigned not null auto_increment,
    -> first_name       varchar(150) not null,
    -> last_name        varchar(150) not null,
    -> address  varchar(250) not null,
    -> city     varchar(150) not null,
    -> state    varchar(150) not null,
    -> zip      int not null,
    -> phone_number     int not null,
    -> email    varchar(150) not null,
    -> primary key (id)
    -> );
Query OK, 0 rows affected (0.97 sec)

mysql> describe addressbook;
+--------------+--------------+------+-----+---------+----------------+
| Field        | Type         | Null | Key | Default | Extra          |
+--------------+--------------+------+-----+---------+----------------+
| id           | int unsigned | NO   | PRI | NULL    | auto_increment |
| first_name   | varchar(150) | NO   |     | NULL    |                |
| last_name    | varchar(150) | NO   |     | NULL    |                |
| address      | varchar(250) | NO   |     | NULL    |                |
| city         | varchar(150) | NO   |     | NULL    |                |
| state        | varchar(150) | NO   |     | NULL    |                |
| zip          | int          | NO   |     | NULL    |                |
| phone_number | int          | NO   |     | NULL    |                |
| email        | varchar(150) | NO   |     | NULL    |                |
+--------------+--------------+------+-----+---------+----------------+
9 rows in set (0.00 sec)

mysql> insert into addressbook (first_name,last_name,address,city,state,zip,phon
e_number,email) values
    -> ('Amit','Kumar','k-type','Jamshedpur','Jharkhand',831004,1258623,'abc@xyz
.com'),
    -> ('Manish','Singh','P-type','Bangluru','Karnataka',123456,8543912,'xyz@abc
.com'),
    -> ('Aman','Thakur','X-type','Cuttack','Odisha',789456,1234595,'jas@jhds.com
');
Query OK, 3 rows affected (0.14 sec)
Records: 3  Duplicates: 0  Warnings: 0

mysql> select * from addressbook;
+----+------------+-----------+---------+------------+-----------+--------+-----
---------+--------------+
| id | first_name | last_name | address | city       | state     | zip    | phon
e_number | email        |
+----+------------+-----------+---------+------------+-----------+--------+-----
---------+--------------+
|  4 | Amit       | Kumar     | k-type  | Jamshedpur | Jharkhand | 831004 |
 1258623 | abc@xyz.com  |
|  5 | Manish     | Singh     | P-type  | Bangluru   | Karnataka | 123456 |
 8543912 | xyz@abc.com  |
|  6 | Aman       | Thakur    | X-type  | Cuttack    | Odisha    | 789456 |
 1234595 | jas@jhds.com |
+----+------------+-----------+---------+------------+-----------+--------+-----
---------+--------------+
3 rows in set (0.00 sec)


mysql> update addressbook set city='Jamshedpur' where first_name='Manish';
Query OK, 1 row affected (0.05 sec)
Rows matched: 1  Changed: 1  Warnings: 0

mysql> select * from addressbook;
+----+------------+-----------+---------+------------+-----------+--------+-----
---------+--------------+
| id | first_name | last_name | address | city       | state     | zip    | phon
e_number | email        |
+----+------------+-----------+---------+------------+-----------+--------+-----
---------+--------------+
|  4 | Amit       | Kumar     | k-type  | Jamshedpur | Jharkhand | 831004 |
 1258623 | abc@xyz.com  |
|  5 | Manish     | Singh     | P-type  | Jamshedpur | Karnataka | 123456 |
 8543912 | xyz@abc.com  |
|  6 | Aman       | Thakur    | X-type  | Cuttack    | Odisha    | 789456 |
 1234595 | jas@jhds.com |
+----+------------+-----------+---------+------------+-----------+--------+-----
---------+--------------+
3 rows in set (0.03 sec)


mysql> delete from addressbook where first_name='Aman';
Query OK, 1 row affected (0.17 sec)

mysql> select * from addressbook;
+----+------------+-----------+---------+------------+-----------+--------+-----
---------+-------------+
| id | first_name | last_name | address | city       | state     | zip    | phon
e_number | email       |
+----+------------+-----------+---------+------------+-----------+--------+-----
---------+-------------+
|  4 | Amit       | Kumar     | k-type  | Jamshedpur | Jharkhand | 831004 |
 1258623 | abc@xyz.com |
|  5 | Manish     | Singh     | P-type  | Jamshedpur | Karnataka | 123456 |
 8543912 | xyz@abc.com |
+----+------------+-----------+---------+------------+-----------+--------+-----
---------+-------------+
2 rows in set (0.02 sec)


mysql> select * from addressbook where state='Jharkhand';
+----+------------+-----------+---------+------------+-----------+--------+-----
---------+-------------+
| id | first_name | last_name | address | city       | state     | zip    | phon
e_number | email       |
+----+------------+-----------+---------+------------+-----------+--------+-----
---------+-------------+
|  4 | Amit       | Kumar     | k-type  | Jamshedpur | Jharkhand | 831004 |
 1258623 | abc@xyz.com |
+----+------------+-----------+---------+------------+-----------+--------+-----
---------+-------------+
1 row in set (0.00 sec)


mysql> select count(city),count(state) from addressbook;
+-------------+--------------+
| count(city) | count(state) |
+-------------+--------------+
|           2 |            2 |
+-------------+--------------+
1 row in set (0.04 sec)

